id,title,score,comments,time
46555615,Why is SendGrid emailing me about supporting ICE?,94,48,2026-01-09 16:36:48
46542036,AI coding assistants are getting worse?,419,659,2026-01-08 15:20:15
46544276,Replit founder Amjad Masad isn’t afraid of Silicon Valley,275,426,2026-01-08 18:05:02
46545077,Google AI Studio is now sponsoring Tailwind CSS,728,276,2026-01-08 19:09:23
46491330,Why is there a tiny hole in the airplane window? (2023),70,41,2026-01-04 19:31:43
46454160,Making Magic Leap past Nvidia's secure bootchain and breaking Tesla Autopilots,74,19,2026-01-01 13:58:45
