id,title,score,comments,time
46598991,"FOSS in times of war, scarcity and (adversarial) AI [video]",56,27,2026-01-13 09:47:59
46599341,Show HN: An iOS budget app I've been maintaining since 2011,40,16,2026-01-13 10:44:39
46590280,TimeCapsuleLLM: LLM trained only on data from 1800-1875,635,264,2026-01-12 16:04:27
46593395,The chess bot on Delta Air Lines will destroy you (2024) [video],259,231,2026-01-12 19:57:37
46591100,Show HN: AI in SolidWorks,172,90,2026-01-12 16:56:17
46599897,"Owners, not renters: Mozilla's open source AI strategy",8,1,2026-01-13 12:00:12
46549039,Zirgen: Compiler for a Domain-Specific Language,14,0,2026-01-09 01:29:29
46592344,Show HN: Yolobox – Run AI coding agents with full sudo without nuking home dir,99,73,2026-01-12 18:34:02
46595419,Google removes AI health summaries after investigation finds dangerous flaws,195,133,2026-01-12 23:05:04
