id,title,score,comments,time
46614487,More sustainable epoxy thanks to phosphorus,41,13,2026-01-14 10:43:31
46666963,Starting from scratch: Training a 30M Topological Transformer,89,23,2026-01-18 11:39:14
46665169,Show HN: Figma-use – CLI to control Figma for AI agents,61,26,2026-01-18 05:55:48
46669663,Sins of the Children (Adrian Tchaikovsky),3,0,2026-01-18 17:08:58
46668021,Predicting OpenAI's ad strategy,372,273,2026-01-18 14:25:49
46660543,Raising money fucked me up,343,131,2026-01-17 18:29:00
