id,title,score,comments,time
46463644,10 years of personal finances in plain text files,77,27,2026-01-02 11:07:51
46462702,Standard Ebooks: Public Domain Day 2026 in Literature,142,21,2026-01-02 08:40:41
46463407,One Number I Trust: Plain-Text Accounting for a Multi-Currency Household,25,6,2026-01-02 10:25:11
46460440,Happy Public Domain Day 2026,316,63,2026-01-02 01:42:16
46462108,"FreeBSD: Home NAS, part 1 – configuring ZFS mirror (RAID1)",67,6,2026-01-02 06:48:32
46456797,Finland detains ship and its crew after critical undersea cable damaged,446,491,2026-01-01 18:46:07
46457027,Dell's version of the DGX Spark fixes pain points,139,74,2026-01-01 19:11:53
46461347,AB316: No AI Scapegoating Allowed,18,8,2026-01-02 04:15:53
