id,title,score,comments,time
46264492,Hashcards: A plain-text spaced repetition system,293,137,2025-12-14 16:55:29
46262021,Shai-Hulud compromised a dev machine and raided GitHub org access: a post-mortem,209,128,2025-12-14 10:07:00
46262816,AI and the ironies of automation – Part 2,229,101,2025-12-14 13:19:15
46268844,"Microsoft Copilot AI Comes to LG TVs, and Can't Be Deleted",118,99,2025-12-15 00:35:41
46270877,"Nvidia-backed Starcloud trains first AI model in space, orbital data centers",5,1,2025-12-15 05:45:43
46265811,GNU recutils: Plain text database,137,42,2025-12-14 19:08:57
46258163,Recovering Anthony Bourdain's Li.st's,292,135,2025-12-13 21:18:01
46223617,Show HN: Cargo-rail: graph-aware monorepo tooling for Rust; 11 deps,60,3,2025-12-10 20:49:22
