id,title,score,comments,time
46560445,“Erdos problem #728 was solved more or less autonomously by AI”,358,212,2026-01-09 22:39:15
46511555,Greenland sharks maintain vision for centuries through DNA repair mechanism,58,12,2026-01-06 12:44:52
46562301,Maine's black market for baby eels,19,8,2026-01-10 02:56:50
46557057,My article on why AI is great (or terrible) or how to use it,98,146,2026-01-09 18:17:24
46549231,Show HN: A website that auctions itself daily,31,11,2026-01-09 01:59:32
46557823,Show HN: EuConform – Offline-first EU AI Act compliance tool (open source),57,34,2026-01-09 19:11:57
46555615,SendGrid isn’t emailing about ICE or BLM – it’s a phishing attack,180,123,2026-01-09 16:36:48
