id,title,score,comments,time
46709543,Show HN: Rails UI,149,83,2026-01-21 18:31:19
46708678,"Waiting for dawn in search: Search index, Google rulings and impact on Kagi",263,155,2026-01-21 17:28:03
46699324,Ask HN: Why are so many rolling out their own AI/LLM agent sandboxing solution?,13,7,2026-01-20 23:52:32
46710756,Show HN: Retain – A unified knowledge base for all your AI coding conversations,32,9,2026-01-21 19:59:42
46709320,"GenAI, the snake eating its own tail",77,87,2026-01-21 18:14:34
