id,title,score,comments,time
46380399,Asterisk AI Voice Agent,77,37,2025-12-24 23:25:37
46377597,"Show HN: Vibium – Browser automation for AI and humans, by Selenium's creator",273,87,2025-12-24 17:49:02
46379183,Nvidia buying AI chip startup Groq for about $20B in cash,456,268,2025-12-24 21:02:15
46380953,The Next-Gen Mainboard Designed with AmigaOS4 and MorphOS in Mind,14,3,2025-12-25 00:38:09
46317687,A faster path to container images in Bazel,78,38,2025-12-18 19:50:29
46382033,AI Withholds Life-or-Death Information Unless You Know the Magic Words,17,1,2025-12-25 04:19:23
46377070,"Show HN: A local-first, reversible PII scrubber for AI workflows",29,6,2025-12-24 16:44:17
46381813,Microsoft denies rewriting Windows 11 in Rust using AI,56,58,2025-12-25 03:26:58
