id,title,score,comments,time
46701114,"Libbbf: Bound Book Format, A high-performance container for comics and manga",29,7,2026-01-21 04:27:08
46695628,"A 26,000-year astronomical monument hidden in plain sight (2019)",428,90,2026-01-20 18:16:09
46701733,Curl removes bug bounties because of AI slop,10,0,2026-01-21 06:07:03
46698370,Which AI Lies Best? A game theory classic designed by John Nash,96,47,2026-01-20 22:09:49
46656759,Show HN: I built a tool to assist AI agents to know when a PR is good to go,39,32,2026-01-17 09:55:56
46696276,"Maintenance: Of Everything, Part One",92,17,2026-01-20 19:01:30
46642490,Show HN: Aventos – An experiment in cheap AI SEO,16,9,2026-01-16 02:57:37
46700146,Verizon starts requiring 365 days of paid service before it will unlock phones,83,81,2026-01-21 01:37:41
