id,title,score,comments,time
46567392,AI is a business model stress test,172,195,2026-01-10 16:56:34
46569061,"Show HN: Play poker with LLMs, or watch them play against each other",68,40,2026-01-10 19:27:39
46571166,Show HN: GlyphLang – An AI-first programming language,17,12,2026-01-10 23:46:58
46547024,Side-by-side comparison of how AI models answer moral dilemmas,74,45,2026-01-08 21:53:06
46569075,"Bichon: A lightweight, high-performance Rust email archiver with WebUI",51,17,2026-01-10 19:29:05
46570440,Tux Paint,13,2,2026-01-10 22:13:14
46571973,"U.S. airstrikes hit ISIS targets in Syria, officials say",3,0,2026-01-11 01:48:16
46521031,The modern peril of the availability heuristic,5,0,2026-01-07 00:45:01
