id,title,score,comments,time
46716696,In Praise of APL (1977),42,28,2026-01-22 08:44:56
46712678,Your brain on ChatGPT: Accumulation of cognitive debt when using an AI assistant,293,202,2026-01-21 22:41:45
46718485,"Satya Nadella: ""We need to find something useful for AI""",10,4,2026-01-22 12:41:49
46711574,"eBay explicitly bans AI ""buy for me"" agents in user agreement update",168,187,2026-01-21 21:07:47
46708678,"Waiting for dawn in search: Search index, Google rulings and impact on Kagi",352,207,2026-01-21 17:28:03
46709543,Show HN: Rails UI,183,90,2026-01-21 18:31:19
46706796,Show HN: yolo-cage – AI coding agents that can't exfiltrate secrets,55,69,2026-01-21 15:13:29
