id,title,score,comments,time
46647491,6-Day and IP Address Certificates Are Generally Available,427,241,2026-01-16 15:37:19
46652617,Releasing rainbow tables to accelerate Net-NTLMv1 protocol deprecation,128,72,2026-01-16 21:42:24
46648714,"Zep AI (Agent Context Engineering, YC W24) Is Hiring Forward Deployed Engineers",1,0,2026-01-16 17:00:29
46646263,"Michelangelo's first painting, created when he was 12 or 13",351,167,2026-01-16 13:44:25
46646226,Dev-owned testing: Why it fails in practice and succeeds in theory,140,159,2026-01-16 13:39:31
46648144,Launch HN: Indy (YC S21) – A support app designed for ADHD brains,74,83,2026-01-16 16:20:21
