id,title,score,comments,time
46497164,Anna's Archive Loses .Org Domain After Surprise Suspension,167,52,2026-01-05 10:23:32
46494734,"During Helene, I just wanted a plain text website",252,141,2026-01-05 02:36:20
46495539,Building a Rust-style static analyzer for C++ with AI,73,35,2026-01-05 05:11:59
46488576,Web development is fun again,414,504,2026-01-04 15:00:18
46492063,Eurostar AI vulnerability: When a chatbot goes off the rails,172,42,2026-01-04 20:52:52
46489830,Trellis AI (YC W24) is hiring engineers to build AI agents for healthcare access,1,0,2026-01-04 17:01:43
46471648,Show HN: I used AI to recreate a $4000 piece of audio hardware as a plugin,146,99,2026-01-03 01:08:35
