id,title,score,comments,time
46590280,TimeCapsuleLLM: LLM trained only on data from 1800-1875,553,226,2026-01-12 16:04:27
46593395,The chess bot on Delta Air Lines will destroy you (2024) [video],205,156,2026-01-12 19:57:37
46534157,HP Reveals Keyboard Computer with Ryzen AI Chip,24,29,2026-01-07 22:36:41
46591100,Show HN: AI in SolidWorks,147,79,2026-01-12 16:56:17
46592344,Show HN: Yolobox – Run AI coding agents with full sudo without nuking home dir,74,59,2026-01-12 18:34:02
46595419,Google removes AI health summaries after investigation finds dangerous flaws,140,83,2026-01-12 23:05:04
46528502,GitHub: A case study in link maintenance and 404 pages (2013),18,4,2026-01-07 16:36:22
46592424,Superhuman AI exfiltrates emails,45,4,2026-01-12 18:38:39
46540598,Using DistributedDataParallel to train a base model from scratch in the cloud,9,0,2026-01-08 13:15:10
