id,title,score,comments,time
46262816,AI and the ironies of automation – Part 2,6,0,2025-12-14 13:19:15
46258163,Recovering Anthony Bourdain's Li.st's,233,104,2025-12-13 21:18:01
46223617,Show HN: Cargo-rail: graph-aware monorepo tooling for Rust; 11 deps,7,1,2025-12-10 20:49:22
46217126,Create a Markdown Editor in Ruby on Rails,25,2,2025-12-10 12:50:46
46260106,"If a Meta AI model can read a brain-wide signal, why wouldn't the brain?",111,65,2025-12-14 01:43:33
46257339,VPN location claims don't match real traffic exits,426,266,2025-12-13 19:46:19
46255285,Ask HN: How can I get better at using AI for programming?,374,378,2025-12-13 15:37:16
46250332,"OpenAI are quietly adopting skills, now available in ChatGPT and Codex CLI",554,311,2025-12-12 23:30:19
