id,title,score,comments,time
46760099,Scientists identify brain waves that define the limits of 'you',139,26,2026-01-26 00:10:42
46759352,Case study: Creative math – How AI fakes proofs,75,46,2026-01-25 22:44:50
46759850,Show HN: A desktop app that blocks work when you bite your nails,7,0,2026-01-25 23:38:55
46757162,"Spanish track was fractured before high-speed train disaster, report finds",181,153,2026-01-25 19:12:50
46756427,Show HN: An interactive map of US lighthouses and navigational aids,61,19,2026-01-25 18:06:26
46753708,Web-based image editor modeled after Deluxe Paint,202,19,2026-01-25 12:54:53
46756117,ICE using Palantir tool that feeds on Medicaid data,1101,673,2026-01-25 17:36:19
46760237,Clawdbot - open source personal AI assistant,194,131,2026-01-26 00:27:41
