id,title,score,comments,time
46762882,The Holy Grail of Linux Binary Compatibility: Musl and Dlopen,89,67,2026-01-26 07:41:52
46760099,Scientists identify brain waves that define the limits of 'you',217,55,2026-01-26 00:10:42
46759352,Case study: Creative math – How AI fakes proofs,100,65,2026-01-25 22:44:50
46760237,Clawdbot - open source personal AI assistant,274,181,2026-01-26 00:27:41
46756427,Show HN: An interactive map of US lighthouses and navigational aids,77,19,2026-01-25 18:06:26
46764789,EU investigates Elon Musk's X over Grok AI sexual deepfakes,14,1,2026-01-26 12:19:16
46756117,ICE using Palantir tool that feeds on Medicaid data,1265,757,2026-01-25 17:36:19
46763635,"AI is hitting UK harder than other big economies, study finds",10,8,2026-01-26 09:50:35
46757162,"Spanish track was fractured before high-speed train disaster, report finds",204,187,2026-01-25 19:12:50
