id,title,score,comments,time
46560445,“Erdos problem #728 was solved more or less autonomously by AI”,510,275,2026-01-09 22:39:15
46511555,Greenland sharks maintain vision for centuries through DNA repair mechanism,144,55,2026-01-06 12:44:52
46564618,I got paid minimum wage to solve an impossible problem,26,10,2026-01-10 10:53:28
46557057,My article on why AI is great (or terrible) or how to use it,123,193,2026-01-09 18:17:24
46521038,The paradox of failed resolutions,10,1,2026-01-07 00:45:38
46549231,Show HN: A website that auctions itself daily,34,14,2026-01-09 01:59:32
46557823,Show HN: EuConform – Offline-first EU AI Act compliance tool (open source),65,40,2026-01-09 19:11:57
46555615,SendGrid isn’t emailing about ICE or BLM – it’s a phishing attack,193,130,2026-01-09 16:36:48
46564550,"""We write to ask that you enforce your app stores' terms of service against X"" [pdf]",30,3,2026-01-10 10:41:16
